,number,value,datetime_start,datetime_complete,duration,params_activation_fn,params_batch_size,params_clip_range,params_ent_coef,params_gae_lambda,params_gamma,params_learning_rate,params_max_grad_norm,params_n_epochs,params_n_steps,params_net_arch,params_vf_coef,state
0,0,370.50533520000005,2024-12-10 18:28:36.947317,2024-12-10 18:33:32.616274,0 days 00:04:55.668957,relu,256,0.1,0.0030332008184296225,0.8,0.9999,0.30568264715427396,2.0,20,256,tiny,0.08557624932819574,COMPLETE
1,1,394.9670174,2024-12-10 18:28:36.948158,2024-12-10 18:32:57.695409,0 days 00:04:20.747251,tanh,128,0.2,0.0035984337732057805,0.9,0.995,0.0012218453788412304,0.5,1,256,tiny,0.5403022716757532,COMPLETE
2,2,2484.7142946,2024-12-10 18:32:57.699777,2024-12-10 18:41:51.584906,0 days 00:08:53.885129,tanh,32,0.3,2.4899465105559113e-07,0.92,0.995,0.0002870094006171164,2.0,20,512,small,0.36328911801171604,COMPLETE
3,3,832.3483032,2024-12-10 18:33:32.617181,2024-12-10 18:37:19.531213,0 days 00:03:46.914032,relu,128,0.3,1.1195081077330302e-05,0.99,0.9999,1.5439043134393595e-05,0.6,1,2048,medium,0.21657576788600452,COMPLETE
4,4,410.96112780000004,2024-12-10 18:37:19.532124,2024-12-10 18:41:14.877867,0 days 00:03:55.345743,tanh,128,0.1,1.658519442846519e-05,0.95,0.9,0.05193248586870554,5.0,10,256,tiny,0.1603640716698136,COMPLETE
5,5,,2024-12-10 18:41:14.878753,2024-12-10 18:41:26.074959,0 days 00:00:11.196206,relu,16,0.4,0.002295753930834042,0.8,0.99,0.0833818021140302,0.6,10,512,medium,0.13786158389307213,PRUNED
6,6,371.1896982,2024-12-10 18:41:26.075725,2024-12-10 18:49:02.584698,0 days 00:07:36.508973,tanh,8,0.1,0.026466173315774662,1.0,0.9,0.010811605333260792,1.0,10,256,small,0.08845781554583887,COMPLETE
7,7,866.8896268000001,2024-12-10 18:41:51.585746,2024-12-10 18:45:19.715852,0 days 00:03:28.130106,relu,32,0.2,5.9512489814018764e-08,0.95,0.999,0.010280006000496457,0.3,10,32,small,0.7154110100986515,COMPLETE
8,8,828.1352796000001,2024-12-10 18:45:19.716689,2024-12-10 18:47:36.472612,0 days 00:02:16.755923,relu,16,0.3,0.0001489199036212785,0.99,0.95,5.547373820171014e-05,1.0,1,128,medium,0.49618343388875685,COMPLETE
9,9,2546.6689082000003,2024-12-10 18:47:36.474603,2024-12-10 18:53:19.573886,0 days 00:05:43.099283,tanh,16,0.3,5.252029612790795e-07,0.98,0.99,5.707973104780219e-05,0.5,20,256,tiny,0.539445744362043,COMPLETE
10,10,,2024-12-10 18:49:02.585473,2024-12-10 18:49:57.221317,0 days 00:00:54.635844,tanh,512,0.4,2.789337366912483e-05,0.98,0.99,0.33781583773320933,0.6,10,16,small,0.35570422229932375,PRUNED
11,11,701.4611002,2024-12-10 18:49:57.221902,2024-12-10 18:53:45.037671,0 days 00:03:47.815769,tanh,32,0.3,1.5698898778872845e-07,0.92,0.99,0.001967504694255058,0.9,20,512,small,0.24851490790726022,COMPLETE
12,12,385.8302688,2024-12-10 18:53:19.574625,2024-12-10 18:56:10.922666,0 days 00:02:51.348041,tanh,16,0.4,2.0072472111712617e-07,0.98,0.99,0.00090604126133182,5.0,5,256,tiny,0.345600948121597,PRUNED
13,13,355.84917319999994,2024-12-10 18:53:45.039619,2024-12-10 18:59:47.086273,0 days 00:06:02.046654,tanh,16,0.3,1.0467077321479186e-06,0.92,0.999,2.7208585636005667e-05,0.5,20,16,tiny,0.5824205445122035,PRUNED
14,14,1407.9146482,2024-12-10 18:56:10.923297,2024-12-10 18:59:53.099679,0 days 00:03:42.176382,tanh,16,0.3,2.471817337162573e-07,0.98,0.95,3.2484314281691345e-05,0.8,10,256,tiny,0.7177804230657835,COMPLETE
15,15,740.6444136,2024-12-10 18:59:47.086885,2024-12-10 19:05:34.713472,0 days 00:05:47.626587,tanh,16,0.3,1.7203023474971862e-05,0.98,0.995,0.0010687127034663148,2.0,20,256,small,0.2611723115687815,PRUNED
16,16,1616.4377606000003,2024-12-10 18:59:53.101605,2024-12-10 19:02:06.186601,0 days 00:02:13.084996,tanh,512,0.3,1.6087636807920317e-05,0.98,0.99,7.257795765788655e-05,1.0,20,256,tiny,0.1849986423203257,COMPLETE
17,17,359.3727912,2024-12-10 19:02:06.187341,2024-12-10 19:11:09.509312,0 days 00:09:03.321971,tanh,32,0.4,1.6973369029363963e-06,0.98,0.995,3.809482028752113e-05,0.5,20,8,medium,0.5906794955440773,PRUNED
18,18,1785.343925,2024-12-10 19:05:34.714073,2024-12-10 19:09:07.519345,0 days 00:03:32.805272,relu,32,0.2,1.5910116187624934e-06,0.92,0.95,4.3650014538892426e-05,2.0,20,2048,small,0.5328169185918098,COMPLETE
19,19,405.3554318,2024-12-10 19:09:07.520162,2024-12-10 19:18:01.344349,0 days 00:08:53.824187,relu,8,0.3,2.0443587874580772e-07,0.98,0.99,0.01711375758049038,0.5,20,32,tiny,0.6973811512385754,PRUNED
20,20,466.93793020000004,2024-12-10 19:11:09.510174,2024-12-10 19:16:08.271980,0 days 00:04:58.761806,relu,16,0.3,6.347554350171973e-08,1.0,0.9,0.00023510351271012266,1.0,20,256,medium,0.8436882781108126,PRUNED
21,21,1843.3013012,2024-12-10 19:16:08.272604,2024-12-10 19:18:19.310051,0 days 00:02:11.037447,tanh,32,0.3,1.1482970565447005e-08,1.0,0.995,0.0003230718290655875,0.7,1,512,tiny,0.4186669974176325,COMPLETE
22,22,1305.1004977999999,2024-12-10 19:18:01.345428,2024-12-10 19:24:28.891448,0 days 00:06:27.546020,relu,32,0.2,2.6512315063313307e-07,1.0,0.98,4.321368516282983e-05,2.0,20,512,small,0.3044527766221477,COMPLETE
23,23,544.3285066,2024-12-10 19:18:19.311180,2024-12-10 19:20:36.464543,0 days 00:02:17.153363,tanh,32,0.3,1.2078010316924329e-05,0.99,0.9,0.0001306561907920202,5.0,1,512,tiny,0.6005362810312375,PRUNED
24,24,850.5287151999999,2024-12-10 19:20:36.465191,2024-12-10 19:22:58.898299,0 days 00:02:22.433108,tanh,64,0.1,1.395311028818943e-08,1.0,0.995,0.00031498841482467406,0.8,1,512,tiny,0.33831257319026187,COMPLETE
25,25,444.14652340000004,2024-12-10 19:22:58.899102,2024-12-10 19:26:15.401038,0 days 00:03:16.501936,tanh,128,0.4,2.233174504069772e-07,0.92,0.995,0.0039057816253337883,2.0,20,512,small,0.41117463326923587,PRUNED
26,26,657.629517,2024-12-10 19:24:28.893574,2024-12-10 19:28:58.637644,0 days 00:04:29.744070,tanh,32,0.3,6.751851255562196e-08,0.92,0.995,0.0003882642141946929,2.0,10,32,tiny,0.1337758962159014,PRUNED
27,27,1100.3277150000001,2024-12-10 19:26:15.408316,2024-12-10 19:28:55.188178,0 days 00:02:39.779862,tanh,32,0.3,2.622271264292207e-08,0.92,0.995,0.0014053441731226733,0.6,1,256,tiny,0.5620740457485405,COMPLETE
28,28,716.066723,2024-12-10 19:28:55.190059,2024-12-10 19:32:04.535981,0 days 00:03:09.345922,tanh,32,0.3,3.361145354333276e-08,0.8,0.9,6.56274121331406e-05,2.0,5,512,tiny,0.24634544680185028,PRUNED
29,29,1569.6541432000001,2024-12-10 19:28:58.638313,2024-12-10 19:31:28.944943,0 days 00:02:30.306630,tanh,32,0.3,1.0261330518250011e-08,1.0,0.9,0.00044635346227446456,0.7,1,512,tiny,0.2589343368119067,COMPLETE
30,30,366.93893399999996,2024-12-10 19:31:28.945644,2024-12-10 19:35:23.304470,0 days 00:03:54.358826,tanh,32,0.2,1.9938134562210134e-08,1.0,0.995,0.0031893864066675167,1.0,10,512,small,0.21375211956301832,PRUNED
31,31,714.1599865999999,2024-12-10 19:32:04.536536,2024-12-10 19:34:26.028127,0 days 00:02:21.491591,tanh,512,0.3,1.3563151590213095e-07,0.98,0.99,0.00012332572169596666,0.5,1,256,tiny,0.6219284150849699,PRUNED
32,32,371.2296808,2024-12-10 19:34:26.028708,2024-12-10 19:40:49.047185,0 days 00:06:23.018477,relu,8,0.2,1.238528178575698e-05,0.92,0.995,0.00012759357534108484,2.0,10,16,small,0.5102903422123674,PRUNED
33,33,447.7026024,2024-12-10 19:35:23.305082,2024-12-10 19:37:36.758629,0 days 00:02:13.453547,tanh,128,0.1,2.439966127732587e-07,1.0,0.9999,2.1607821849358253e-05,0.5,20,256,tiny,0.45703554430843835,PRUNED
34,34,1537.5461004,2024-12-10 19:37:36.759190,2024-12-10 19:41:11.020233,0 days 00:03:34.261043,relu,32,0.1,1.8832491401346787e-07,0.92,0.95,3.543572672346502e-05,2.0,20,64,small,0.6647742471042144,COMPLETE
35,35,2371.3200964,2024-12-10 19:40:49.047769,2024-12-10 19:51:45.626619,0 days 00:10:56.578850,relu,8,0.2,6.8725586880558814e-06,0.92,0.95,3.9824287024030144e-05,5.0,20,2048,small,0.762785320835212,COMPLETE
36,36,1655.2225838000002,2024-12-10 19:41:11.021017,2024-12-10 19:44:36.050811,0 days 00:03:25.029794,relu,32,0.2,8.174035532910845e-05,0.92,0.95,3.5362246367817855e-05,5.0,20,2048,small,0.5117405917883094,COMPLETE
37,37,472.2718844,2024-12-10 19:44:36.051650,2024-12-10 19:46:36.463199,0 days 00:02:00.411549,tanh,32,0.2,2.746560039718009e-08,1.0,0.995,0.0018421879560601795,0.7,1,2048,medium,0.7510329300569527,PRUNED
38,38,664.0409578,2024-12-10 19:46:36.463779,2024-12-10 19:48:33.454551,0 days 00:01:56.990772,relu,16,0.4,1.4108305403967823e-07,0.92,0.995,7.079098376735458e-05,0.7,1,512,tiny,0.3826918930748522,PRUNED
39,39,1931.4794144,2024-12-10 19:48:33.455163,2024-12-10 19:53:27.148661,0 days 00:04:53.693498,relu,16,0.2,2.2156833516500245e-05,0.99,0.99,4.7738221986759394e-05,2.0,20,2048,medium,0.5397425796550631,COMPLETE
40,40,1869.2530484,2024-12-10 19:51:45.627484,2024-12-10 19:59:38.905127,0 days 00:07:53.277643,relu,8,0.2,0.0038276288199974567,0.92,0.98,4.1523241390850304e-05,0.5,20,2048,tiny,0.8557136421286882,COMPLETE
41,41,449.9248796,2024-12-10 19:53:27.149394,2024-12-10 19:57:58.651303,0 days 00:04:31.501909,relu,16,0.2,0.00021958808839524091,0.99,0.9999,3.285529238280902e-05,2.0,20,256,medium,0.19894658181232822,PRUNED
42,42,373.6090948,2024-12-10 19:57:58.651913,2024-12-10 20:03:14.181478,0 days 00:05:15.529565,relu,16,0.4,0.00020502919914236242,0.99,0.99,0.0006095718892154019,2.0,20,2048,medium,0.41358007637263416,PRUNED
43,43,2428.0327524,2024-12-10 19:59:38.905904,2024-12-10 20:03:16.120672,0 days 00:03:37.214768,relu,32,0.2,2.1945495482291712e-05,0.99,0.99,3.373204364613298e-05,0.7,20,1024,medium,0.514490835412742,COMPLETE
44,44,1992.04941,2024-12-10 20:03:14.182064,2024-12-10 20:12:35.097085,0 days 00:09:20.915021,relu,8,0.3,0.0001755795391020008,0.98,0.98,4.0306425211855035e-05,0.5,20,2048,tiny,0.7984631495788873,COMPLETE
45,45,2582.029482,2024-12-10 20:03:16.121371,2024-12-10 20:07:56.845713,0 days 00:04:40.724342,relu,16,0.2,6.940040122770883e-05,0.99,0.99,5.34854895110202e-05,0.7,20,1024,medium,0.5742893458981521,COMPLETE
46,46,1762.8781684,2024-12-10 20:07:56.846464,2024-12-10 20:12:07.974511,0 days 00:04:11.128047,relu,32,0.2,0.02190005249214129,0.99,0.99,9.680339232896044e-05,0.7,20,1024,small,0.4963764151126491,COMPLETE
47,47,1824.8615863999999,2024-12-10 20:12:07.975386,2024-12-10 20:16:56.817221,0 days 00:04:48.841835,relu,64,0.2,3.876783426731397e-05,0.9,0.99,1.1982783500429852e-05,0.7,20,1024,medium,0.9397536470523659,COMPLETE
48,48,817.9390374,2024-12-10 20:12:35.098143,2024-12-10 20:28:28.840800,0 days 00:15:53.742657,relu,16,0.2,4.929341015676988e-05,1.0,0.99,6.418915757049225e-05,0.7,20,8,tiny,0.7277808837636063,PRUNED
49,49,2438.299614,2024-12-10 20:16:56.818199,2024-12-10 20:23:16.719218,0 days 00:06:19.901019,relu,32,0.2,1.1798727714548378e-05,0.95,0.999,0.00011092010384990256,0.7,20,1024,medium,0.5963926444458628,COMPLETE
50,50,1857.6426834000001,2024-12-10 20:23:16.720150,2024-12-10 20:29:42.549874,0 days 00:06:25.829724,relu,32,0.1,5.5442573440493104e-05,0.95,0.99,0.0004670977425509809,0.3,20,1024,medium,0.6762366028506999,COMPLETE
51,51,2463.4455266,2024-12-10 20:28:28.841800,2024-12-10 20:36:00.759174,0 days 00:07:31.917374,relu,32,0.2,2.2880952471862077e-05,0.95,0.995,0.00011068352829540018,0.9,20,1024,medium,0.46659172928015114,COMPLETE
52,52,398.9209226,2024-12-10 20:29:42.550815,2024-12-10 20:34:11.119495,0 days 00:04:28.568680,relu,32,0.2,1.0965822720777882e-05,0.99,0.999,5.52380241045786e-05,0.8,5,1024,medium,0.4412109986877247,PRUNED
53,53,423.63016960000004,2024-12-10 20:34:11.120435,2024-12-10 20:52:09.908714,0 days 00:17:58.788279,relu,8,0.2,2.2291027345422144e-05,0.92,0.9,0.0003344328549141627,1.0,20,256,small,0.9126808862231004,PRUNED
54,54,425.50616500000007,2024-12-10 20:36:00.760051,2024-12-10 20:40:12.370975,0 days 00:04:11.610924,relu,128,0.3,7.683414819266065e-05,0.95,0.995,0.0012128329377617275,0.9,20,1024,medium,0.40169648061994706,PRUNED
55,55,402.77389000000005,2024-12-10 20:40:12.374271,2024-12-10 20:46:29.100790,0 days 00:06:16.726519,relu,32,0.2,2.7850310792784804e-05,0.95,0.999,0.00010904996246553094,0.5,20,32,medium,0.54936639485591,PRUNED
56,56,1682.1619944,2024-12-10 20:46:29.101478,2024-12-10 20:55:39.989708,0 days 00:09:10.888230,relu,8,0.2,0.00012355302011308997,0.99,0.99,1.9758546208328915e-05,0.7,10,1024,medium,0.4049238927347816,COMPLETE
57,57,1361.3147996000002,2024-12-10 20:52:09.909311,2024-12-10 20:59:09.656912,0 days 00:06:59.747601,tanh,32,0.3,6.103317662134388e-08,0.92,0.98,1.9817127260003232e-05,2.0,20,256,small,0.3292143292901672,PRUNED
58,58,1433.6021192,2024-12-10 20:55:39.990789,2024-12-10 21:02:27.412065,0 days 00:06:47.421276,relu,32,0.2,1.1876613943157944e-05,1.0,0.995,1.8762532450261227e-05,0.7,20,1024,medium,0.5243909084876267,PRUNED
59,59,1821.9681626000001,2024-12-10 20:59:09.657563,2024-12-10 21:09:31.743111,0 days 00:10:22.085548,relu,16,0.2,7.687114469381923e-05,0.99,0.9,0.00032702342369484333,0.7,20,1024,medium,0.6643157372082884,COMPLETE
60,60,556.5254838,2024-12-10 21:02:27.413029,2024-12-10 21:11:48.111688,0 days 00:09:20.698659,relu,16,0.3,0.00023685732603213387,0.99,0.95,0.00030050760750880025,0.7,20,1024,medium,0.674511157995183,PRUNED
61,61,1372.9235836,2024-12-10 21:09:31.744091,2024-12-10 21:19:24.114015,0 days 00:09:52.369924,tanh,16,0.3,1.0180082062227926e-07,0.99,0.99,1.5466729413221986e-05,0.5,20,256,small,0.41084300291999065,PRUNED
62,62,2139.7143182,2024-12-10 21:11:48.112587,2024-12-10 21:20:57.281086,0 days 00:09:09.168499,relu,16,0.3,2.400124962431394e-08,0.98,0.99,6.666880990490287e-05,0.5,20,256,tiny,0.39735814833349287,COMPLETE
63,63,390.4820046,2024-12-10 21:19:24.114938,2024-12-10 21:25:10.067260,0 days 00:05:45.952322,relu,32,0.2,0.0006890164662978662,0.99,0.995,0.00013753953488994,0.9,10,128,medium,0.711774429241477,PRUNED
64,64,1148.3383508,2024-12-10 21:20:57.281978,2024-12-10 21:28:50.255310,0 days 00:07:52.973332,relu,32,0.2,0.0001759802300387365,0.95,0.995,0.0006329870030774019,0.9,20,512,medium,0.4118060650947811,PRUNED
65,65,420.57687659999993,2024-12-10 21:25:10.067980,2024-12-10 21:32:47.962129,0 days 00:07:37.894149,relu,32,0.2,0.003525178441732281,0.95,0.995,8.557611220718866e-05,0.9,20,256,small,0.4072499278285886,PRUNED
66,66,2525.9271500000004,2024-12-10 21:28:50.256200,2024-12-10 21:35:56.525387,0 days 00:07:06.269187,tanh,32,0.3,1.5047153278193157e-08,0.99,0.995,2.781234969253007e-05,2.0,20,512,small,0.9424964288381054,COMPLETE
67,67,1782.2625057999999,2024-12-10 21:32:47.963050,2024-12-10 21:44:21.020699,0 days 00:11:33.057649,tanh,16,0.3,3.7121691509355065e-07,0.98,0.99,0.0002805088759368652,0.5,20,64,medium,0.7113248554453613,COMPLETE
68,68,359.663239,2024-12-10 21:35:56.526379,2024-12-10 21:42:31.986075,0 days 00:06:35.459696,relu,32,0.2,4.030692677722027e-06,0.99,0.99,0.0009045643194369433,0.7,20,128,medium,0.5320240748416233,PRUNED
69,69,557.6885018,2024-12-10 21:42:31.986959,2024-12-10 21:46:50.408063,0 days 00:04:18.421104,tanh,256,0.2,1.2483801125283796e-06,0.98,0.999,3.942066102299633e-05,0.7,20,256,medium,0.5544584523203514,PRUNED
70,70,806.3305736,2024-12-10 21:44:21.022588,2024-12-10 21:52:47.747015,0 days 00:08:26.724427,tanh,32,0.3,3.1179295512132705e-08,0.98,0.995,1.6827568801679067e-05,2.0,20,1024,small,0.7985941915912034,PRUNED
71,71,894.6185342000001,2024-12-10 21:46:50.409048,2024-12-10 21:52:20.514852,0 days 00:05:30.105804,tanh,32,0.3,1.5435008880653533e-07,0.99,0.999,0.0007860636734965043,2.0,10,512,small,0.8142672853755036,PRUNED
72,72,2417.5839401999997,2024-12-10 21:52:20.515765,2024-12-10 22:10:13.303928,0 days 00:17:52.788163,relu,8,0.2,3.263418202580468e-06,0.99,0.95,1.5596894179930394e-05,0.7,20,2048,small,0.7347502406713985,COMPLETE
73,73,445.2817588,2024-12-10 21:52:47.747622,2024-12-10 21:58:47.645783,0 days 00:05:59.898161,tanh,32,0.3,1.280228446076875e-05,0.92,0.995,0.0026122455288490358,2.0,20,512,small,0.43605220609523776,PRUNED
74,74,372.5358616,2024-12-10 21:58:47.646483,2024-12-10 22:04:53.378219,0 days 00:06:05.731736,tanh,32,0.4,3.853568796227458e-08,0.95,0.995,3.5701301561521864e-05,2.0,20,512,small,0.9159754727674382,PRUNED
75,75,387.13959120000004,2024-12-10 22:04:53.378953,2024-12-10 22:08:39.678386,0 days 00:03:46.299433,tanh,128,0.3,9.018149822754907e-08,0.99,0.995,8.641887271155696e-05,2.0,5,64,small,0.7084718440429241,PRUNED
76,76,2478.0177362000004,2024-12-10 22:08:39.679519,2024-12-10 22:17:00.396178,0 days 00:08:20.716659,tanh,16,0.3,1.179568375389096e-05,0.98,0.99,0.00013810483749457627,5.0,20,1024,tiny,0.6435359695077054,COMPLETE
77,77,1466.5000943999999,2024-12-10 22:10:13.306065,2024-12-10 22:27:21.414734,0 days 00:17:08.108669,relu,8,0.2,7.623689732728348e-05,0.99,0.95,1.5489980338756724e-05,0.7,20,32,small,0.5731139798583043,PRUNED
78,78,1129.8777201999997,2024-12-10 22:17:00.397195,2024-12-10 22:21:05.752702,0 days 00:04:05.355507,tanh,128,0.3,5.4679571142466454e-05,0.98,0.99,4.5017629614835975e-05,5.0,20,1024,tiny,0.49462482442766,PRUNED
79,79,1548.6134798,2024-12-10 22:21:05.756120,2024-12-10 22:25:56.165259,0 days 00:04:50.409139,relu,64,0.2,4.051430480292803e-05,0.95,0.98,2.3122478925094742e-05,1.0,20,1024,medium,0.24147808281781227,PRUNED
80,80,539.4030456,2024-12-10 22:25:56.166144,2024-12-10 22:35:52.021462,0 days 00:09:55.855318,tanh,16,0.3,5.796365553090464e-06,0.8,0.999,0.0007336998314517657,5.0,20,1024,tiny,0.7923474082568058,PRUNED
81,81,2519.4650389999997,2024-12-10 22:27:21.415443,2024-12-10 22:34:07.679442,0 days 00:06:46.263999,tanh,32,0.3,1.6934587797887212e-08,0.99,0.995,4.8851931623171745e-05,0.9,20,512,small,0.8503691637471237,COMPLETE
82,82,448.0491188,2024-12-10 22:34:07.680700,2024-12-10 22:41:41.957398,0 days 00:07:34.276698,tanh,32,0.3,3.224817036588388e-08,0.99,0.995,0.0011796961040763357,0.9,20,512,small,0.8705290571433058,PRUNED
83,83,689.1176379999999,2024-12-10 22:35:52.022397,2024-12-10 22:41:34.409089,0 days 00:05:42.386692,tanh,64,0.3,4.633954418793892e-08,1.0,0.95,0.00017917356364999137,0.9,20,512,small,0.9246967877385593,PRUNED
84,84,2316.4504434,2024-12-10 22:41:34.409791,2024-12-10 22:47:47.451914,0 days 00:06:13.042123,tanh,32,0.3,2.107859414664456e-08,0.99,0.995,0.00016907217089184558,0.9,20,512,small,0.8588816666078867,COMPLETE
85,85,387.298854,2024-12-10 22:41:41.958042,2024-12-10 22:57:09.007979,0 days 00:15:27.049937,relu,8,0.3,6.238230828213027e-05,0.95,0.999,1.4302046170394788e-05,0.7,20,1024,medium,0.5737852179995927,PRUNED
86,86,381.09242,2024-12-10 22:47:47.452929,2024-12-10 22:56:54.413630,0 days 00:09:06.960701,relu,32,0.2,1.882041930216145e-06,0.95,0.999,9.718250596035725e-05,0.7,20,16,small,0.7918315211215399,PRUNED
87,87,2461.8462128,2024-12-10 22:56:54.414294,2024-12-10 23:06:29.072198,0 days 00:09:34.657904,tanh,16,0.3,9.622675948285543e-07,0.98,0.99,0.00014053293305162166,0.6,20,256,tiny,0.8234534595476738,COMPLETE
88,88,460.59718439999995,2024-12-10 22:57:09.008635,2024-12-10 23:03:40.371378,0 days 00:06:31.362743,relu,32,0.3,7.705421354936143e-07,0.8,0.995,1.4461629140157239e-05,0.9,20,32,medium,0.48448759971574445,PRUNED
89,89,2136.7765346,2024-12-10 23:03:40.372071,2024-12-10 23:16:49.964739,0 days 00:13:09.592668,tanh,8,0.2,3.224587385891875e-08,0.98,0.99,5.553884871183492e-05,0.5,20,128,tiny,0.4266581905908722,COMPLETE
90,90,1501.9103301999999,2024-12-10 23:06:29.073413,2024-12-10 23:21:44.296814,0 days 00:15:15.223401,tanh,8,0.3,1.4883004167993602e-08,0.99,0.995,1.6836108410185284e-05,0.6,20,16,small,0.9356500109414749,PRUNED
91,91,388.3268878,2024-12-10 23:16:49.969838,2024-12-10 23:25:08.129229,0 days 00:08:18.159391,tanh,16,0.3,3.0129494468321154e-07,0.99,0.99,0.004775089022653767,0.6,20,256,tiny,0.6940566561962603,PRUNED
92,92,703.0627545999998,2024-12-10 23:21:44.298336,2024-12-10 23:32:07.095948,0 days 00:10:22.797612,tanh,16,0.3,2.6344978585039165e-07,0.98,0.99,9.461928953301074e-05,0.6,20,256,tiny,0.8347882763770272,PRUNED
93,93,426.2184016,2024-12-10 23:25:08.130095,2024-12-10 23:28:53.334884,0 days 00:03:45.204789,tanh,256,0.3,4.49824866156819e-08,0.95,0.995,1.0445544310492667e-05,1.0,5,512,small,0.9315986800088739,PRUNED
94,94,2765.6775572,2024-12-10 23:28:53.338626,2024-12-10 23:38:14.448004,0 days 00:09:21.109378,tanh,16,0.3,0.00017182124670595984,0.98,0.99,8.170508912845396e-05,2.0,20,256,tiny,0.826807936319546,COMPLETE
95,95,1690.2193338000002,2024-12-10 23:32:07.096623,2024-12-10 23:38:54.135016,0 days 00:06:47.038393,relu,32,0.2,3.5258730016236168e-06,0.95,0.999,0.0003091752963398502,0.7,20,1024,medium,0.5076765859513602,PRUNED
96,96,519.6141046,2024-12-10 23:38:14.452454,2024-12-10 23:47:08.689547,0 days 00:08:54.237093,tanh,16,0.3,5.783145182404454e-07,0.98,0.98,3.1444805016695136e-05,0.6,20,128,tiny,0.3183551740659274,PRUNED
97,97,481.50022060000003,2024-12-10 23:38:54.135812,2024-12-10 23:49:16.783045,0 days 00:10:22.647233,tanh,16,0.3,0.0022394649266425266,0.98,0.99,0.0005401924126963181,0.8,20,256,small,0.8169527105481347,PRUNED
98,98,2162.0113582000004,2024-12-10 23:47:08.693098,2024-12-10 23:52:39.217768,0 days 00:05:30.524670,tanh,128,0.3,9.591919033728586e-08,0.99,0.995,8.93487746360794e-05,2.0,20,512,medium,0.8258847614055776,COMPLETE
99,99,773.7519218,2024-12-10 23:49:16.787378,2024-12-10 23:53:24.659059,0 days 00:04:07.871681,tanh,32,0.3,1.9295184586525907e-07,0.99,0.995,2.706312443724242e-05,2.0,1,512,medium,0.7575609071703009,PRUNED
